name01#0,"""Aki"""
text01#0,"""Ouf, alors c'est comme ça, hein? <%me>, Ca va allez mieux assez vite,merci"""
text02#0,"""Lorsque tu perd ton sang-froid, il est tres important de ce precipiter. Mais amene toujours t'es compagnons."""
text03#0,"""Mon mentor m'a appris cela. Il a dit que si tu as des allies a la tete froide, ils vous arreteraient si vous allez trop loin."""
text04#0,"""Combien de fois ai-je ete sauve par ce que mon mentor m'a appris? ..."""
text05#0,"""... tch, je ne peux pas m'empecher de parler de lui. Nous avons atteint notre objectif, rentrons a la maison."""
